,title,link,summary
0,Преминуо Љубомир Радичевић,http://www.politika.rs/scc/clanak/449401/Preminuo-Ljubomir-Radicevic,"Љубомир Радичевић, редитељ филма „Љубав и мода”, педагог и уредник Телевизије Београд, преминуо је јуче у 93. години у Београду, потврдили су из Филмског центра Србије. Радичевић је рођен 1927. у Београду, дипломирао на Академији за..."
1,Више од сто хиљада људи у свету заражено коронавирусом,http://www.politika.rs/scc/clanak/449400/Vise-od-sto-hiljada-ljudi-u-svetu-zarazeno-koronavirusom,"ПАРИЗ – У свету је од новог коронавируса заражено више од 100.000 људи, од којих је умрло више од 3.400, у више од 90 земаља и територија, јавила је агенција Франс прес нови биланс. У свету су тачно заражене 100.002 особе, а умрло је..."
2,"Патријарх Иринеј упозорио на могуће физичке обрачуне, па и проливање крви у Црној Гори",http://www.politika.rs/scc/clanak/449399/Patrijarh-Irinej-upozorio-na-moguce-fizicke-obracune-pa-i-prolivanje-krvi-u-Crnoj-Gori,"Патријарх Српске православне цркве (СПЦ) Иринеј изразио је забринутост због, како је рекао, могућих физичких обрачуна, „чак и проливања крви” у Црној Гори, наводећи да постоје индиције да би се тако нешто могло догодити. „Порука..."
3,Турска обалска стража спасила 120 миграната,http://www.politika.rs/scc/clanak/449398/Turska-obalska-straza-spasila-120-migranata,"АНКАРА – Турска обалска стража спасила је код Измира рано јутрос око 120 миграната који су покушали да стигну до грчког острва на три гумена чамца, након што им је грчка обалска стража наводно блокирала пролаз. Како Ројтерс јавља, међу..."
4,"Српски играчи у топ форми, али је тим без хармоније",http://www.politika.rs/scc/clanak/449397/Sport/Srpski-igraci-u-top-formi-ali-je-tim-bez-harmonije,"Специјално за „Политику” Осло – Биће то жесток, неизвестан окршај две легије странаца. У полуфиналној утакмици за пласман на предстојеће фудбалско европско првенство, норвешка фудбалска репрезентација, готово као и српска, углавном..."
5,Војска спремна да заштити границу Србије,http://www.politika.rs/scc/clanak/449395/Vojska-spremna-da-zastiti-granicu-Srbije,Министар одбране Александар Вулин изјавио је да је Војска Србије спремна да заштити нашу границу и спречи било какво кретање ако председник Александар ВучИћ процени да је то потребно. „Уколико председник Републике и врховни командант...
6,"Мушкарац возио са 3,39 промила алкохола у крви",http://www.politika.rs/scc/clanak/449393/Muskarac-vozio-sa-3-39-promila-alkohola-u-krvi,"КРАГУЈЕВАЦ – Мушкарац (43) у месту Голочело управљао је возилом са 3,39 промила алкохола у крви, услед чега је изгубио контролу и слетео са пута. У тој саобраћајној незгоди није било повређених. Полиција је саопштила да је против возача..."
7,Шеснаестогодишњак смештен у карантин лесковачке болнице због сумње у коронавирус,http://www.politika.rs/scc/clanak/449391/Sesnaestogodisnjak-smesten-u-karantin-leskovacke-bolnice-zbog-sumnje-u-koronavirus,"ЛЕСКОВАЦ – Дечак (16) из Власотинца смештен је данас у карантин на Инфективном одељењу Опште болнице у Лесковцу због сумње да је оболео од коронавируса, потврдио је агенцији Бета директор те болнице Небојша Димитријевић. Димитријевић је..."
8,Израел земља енергетске ефикасности,http://www.politika.rs/scc/clanak/449389/Izrael-zemlja-energetske-efikasnosti,"Кинеска пословица каже „И пут од хиљаду миља почиње првим кораком”. Кад је реч о примени обновљивих извора енергије (ОИЕ) код нас, тај „први корак” требало би да учинимо што пре, без одлагања. Прелазак са фосилног енергента – угља на..."
9,Ђоковић подржао литије у Црној Гори,http://www.politika.rs/scc/clanak/449390/Dokovic-podrzao-litije-u-Crnoj-Gori,"Најбољи тенисер света Новак Ђоковић послао је данас поруку подршке Србима у Црној Гори. „Поздрав и подршка за братски народ у Црној Гори”, написао је Ђоковић на Твитеру и то ћирилицом. Срби у Црној Гори већ неколико месеци одржавају..."
10,Турска шаље специјалце да штите мигранте,http://www.politika.rs/scc/clanak/449387/Turska-salje-specijalce-da-stite-migrante,"Од нашег дописника Атина – Ситуација на грчко-турској граници је нешто мирнија после окршаја претходних дана, када је турска полиција испаљивала сузавaц на грчку полицију и војску. Међутим, Турска шаље хиљаду специјалаца да, како каже..."
11,"Кад се перје распе, тешко га је покупити",http://www.politika.rs/scc/clanak/449388/Mozaik/Kad-se-perje-raspe-tesko-ga-je-pokupiti,"Први пут се на малом екрану појавио 28. јуна 1990. године, на Видовдан, водио је Јутарњи дневник већ после седмог дана рада у ТВ Београд. Строга, поштована лекторка и дугогодишњи спикер Радио Београда Драга Јонаш била је пуна речи..."
12,Роналдињо избегао оптужбу због коришћења лажног пасоша Парагваја,http://www.politika.rs/scc/clanak/449378/Sport/Ronaldinjo-izbegao-optuzbu-zbog-koriscenja-laznog-pasosa-Paragvaja,"АСУНСИОН – Некада најбољи фудбалер света Бразилац Роналдињо и његов брат Роберто Азис неће бити кривично гоњени, након што су у Парагвају ухапшени због лажног пасоша и личне карте те земље, преноси Ројтера. Како се наводи, државни..."
13,Предаја олимпијске бакље без присуства деце због коронавируса,http://www.politika.rs/scc/clanak/449376/Sport/Ostali-sportovi/Predaja-olimpijske-baklje-bez-prisustva-dece-zbog-koronavirusa,"ТОКИО – Церемонија предаје олимпијске бакље, заказана за 19. март у Грчкој, биће одржана без присуства деце због ситуације са корнавирусом, саопштио је председник организационог одбора Олимпијских игара у Токију Јоширо Мори. Како..."
14,Макаби у „Штарк арени”,http://www.politika.rs/scc/clanak/449375/Sport/Kosarka/Makabi-u-Stark-areni,"Без одмора и правог тренинга кошаркаше Црвене звезде два дана после гостовања Фенербахчеу очекује још веће искушење. У „Штарк арену” долази славни Макаби (19 часова), шестоструки европски првак, који уз водећи Ефес и два шпанска гиганта..."
15,Вучић: Нема места паници због коронавируса,http://www.politika.rs/scc/clanak/449374/Vucic-Nema-mesta-panici-zbog-koronavirusa,"Председник Александар Вучић поновио је данас, након што је откривен први случај коронавируса у Србији, да нема потребе за панику, да надлежни органи раде свој посао како би заштитили здравље грађана и да ће о свему благовремено..."
16,Ухапшен због недозвољених полних радњи,http://www.politika.rs/scc/clanak/449373/Uhapsen-zbog-nedozvoljenih-polnih-radnji,"Припадници Министарства унутрашњих послова у Београду ухапсили су З. Ц. (1963) због постојања основа сумње да је извршио кривично дело недозвољене полне радње, саопштено је из МУП-а Србије. Сумња се да је он у једном аутобусу који је..."
17,Корона вирусом заражено више од сто хиљада људи у свету,http://www.politika.rs/scc/clanak/449371/Korona-virusom-zarazeno-vise-od-sto-hiljada-ljudi-u-svetu,"Епидемијолог Габријел Леунг, шеф катедре за јавно здравство са Универзитета у Хонг Конгу, стручни саветник Светске здравствене организације (СЗО), одржао је конференцију за штампу на којој је епидемију коронавирусом упоредио са..."
18,Жеља добротвора испуњена након 116 година,http://www.politika.rs/scc/clanak/449369/Zelja-dobrotvora-ispunjena-nakon-116-godina,"Смедерево – Вишедеценијска неправда према смедеревском добротвору Дини Манчићу и његовој супрузи Љубици исправљена је недавно, током реконструкције гимназије, за чију су градњу тестаментом завештали део свога имања с кафаном..."
19,Обрачун са Јашаријем је био увод у рат на Космету,http://www.politika.rs/scc/clanak/449370/Obracun-sa-Jasarijem-je-bio-uvod-u-rat-na-Kosmetu,"Ових дана навршава се 22&nbsp;године&nbsp;од разбијања групе ОВК коју је у Дреници предводио Адем Јашари, односно сукоба МУП-а са сепаратистима који је, показаће се, означио ескалацију оружане побуне на Косову и Метохији. ОВК се..."
20,Srbija mora da sprovede presudu suda u Strazburu iz 2013. o nestalim bebama,http://rs.n1info.com/Vesti/a575610/Srbija-mora-da-sprovede-presudu-suda-u-Strazburu-iz-2013.-o-nestalim-bebama.html,"Srbija mora da sprovede presudu Evropskog suda za ljudska prava iz 2013. godine u predmetu ""Zorica Jovanović protiv Srbije"", u vezi s navodima o bebama nestalim iz porodilišta, i da najkasnije do 1. oktobra 2020. godine dostavi sveobuhvatne informacije o tome, odlučio je Komitet ministara Saveta Evrope."
21,"Mihnjak o Zakonu: Što više teče vreme, sve je više oštećenih mama",http://rs.n1info.com/Vesti/a575604/Mihnjak-o-Zakonu-o-podrsci-porodici-Kako-tece-vreme-sve-je-vise-ostecenih-mama.html,"Jasmina Mihnjak sa portala Bebac ocenila je u Danu uživo, govoreći o Zakonu o finansijskoj podršci porodici s decom, da su roditelji ""besni i revoltirani"". ""U julu će deca koja su rođena kada je Zakon stupio na snagu napuniti dve godine. Mi smo sugerisali sve manjkavosti ovog Zakona odmah, a i dalje ništa nije izmenjeno. Što više teče vreme, sve je više oštećenih mama"", kaže ona."
22,Patrijarh Irinej: Narod ne može da se pomiri sa tim da Kosovo bude izvan Srbije,http://rs.n1info.com/Vesti/a575598/Patrijarh-Irinej-Narod-ne-moze-da-se-pomiri-sa-tim-da-Kosovo-bude-izvan-Srbije.html,"Patrijarh srpski Irinej kazao je da srpski narod ne može da se pomiri sa tim da Kosovo bude izvan Srbije i da to, kako je naveo, ""u našu glavu ne može da uđe""."
23,Japanci razvijaju lek za COVID-19 iz krvne plazme,http://rs.n1info.com/Zdravlje/a575522/Japanci-rade-na-leku-za-COVID-19.html,"Japanska farmaceutska kompanija ""Takeda Pharmaceutical"" objavila je da razvija lek za COVID-19 izdvojen iz krvne plazme, dodajući da pregovara sa vlastima u Evropi, SAD-u i Aziji o saradnji na ovom istraživanju."
24,Greta Tunberg predvodila protest mladih za klimu u Briselu,http://rs.n1info.com/Svet/a575606/Greta-Tunberg-predvodila-protest-mladih-za-klimu-u-Briselu.html,"Nekoliko stotina ljudi je u petak u Briselu održalo protest za klimu na poziv organizacije ""Mladi za klimu"" (Youth for Climate) uz učešće švedske aktivistkinje Grete Tunberg."
25,Đoković podržao proteste SPC protiv Zakona o slobodi veroispovesti u Crnoj Gori,http://rs.n1info.com/Region/a575600/Djokovic-podrzao-proteste-SPC-protiv-Zakona-o-slobodi-veroispovesti-u-Crnoj-Gori.html,Prvi teniser sveta Novak Đoković podržao je u petak proteste Srpske pravoslavne crkve protiv Zakona o slobodi veroispovesti kojim crnogorska vlada želi da reši pitanje vlasništva nad verskim objektima u toj zemlji.
26,Treći slučaj zaraze koronavirusom u BiH,http://rs.n1info.com/Region/a575596/Treci-slucaj-zaraze-koronavirusom-u-BiH.html,"Potvrđen je i treći slučaj zaraze koronavirusom u Republici Srpskoj, saopšteno je iz Instituta za javno zdravstvo RS."
27,Bez granica sa Andrejem: Priče iz Japana 2/9,http://rs.n1info.com/Vesti/a575550/Bez-granica-sa-Andrejem-Price-iz-Japana-2/9.html,Tokio. Grad sa najviše stanovnika na planeti. Preko 37 miliona. Većina njih koristi čuveni tokijski metro koji je priča za sebe. Ali grad krije i brojne druge poput one o čuvenom psu Hačiku koji je nakon smrti svog gospodara svaki dan čekao na stanici Šibuja da mu se vrati. Na istoj stanici je i uginuo 10 godina kasnije.
28,U Evropi prošle godine zaplenjeno 36 miliona lekova,http://rs.n1info.com/Svet/a575594/U-Evropi-prosle-godine-zaplenjeno-36-miliona-lekova.html,"U velikoj operaciji protiv šverca lekova u Evropi je prošle godine zaplenjeno 36 miliona lekova i privedeno je 165 osumnjičenih, saopštile su Evropska policijska služba i francuska žandarmerija."
29,Dodik: Neću dozvoliti angažovanje vojske na granici sa Srbijom zbog migranata,http://rs.n1info.com/Region/a575592/Dodik-Necu-dozvoliti-angazovanje-vojske-na-granici-sa-Srbijom-zbog-migranata.html,Srpski član Predsedništva BiH i lider Saveza nezavisnih socijaldemokrata Milorad Dodik ponovio je u Banjaluci da odbija angažovanje pripadnika Oružanih snaga BiH na granici sa Srbijom radi sprečavanja ilegalnih ulazaka migranata u BiH.
30,Javnobeležnička komora osudila napade na pravnike koji overavaju potpise birača,http://rs.n1info.com/Izbori-2020/a575588/Javnobeleznicka-komora-osudila-napade-na-pravnike-koji-overavaju-potpise-biraca.html,"Javnobeležnička komora Srbije je najoštrije osudila, kako navode, nasilno i uvredljivo ponašanje čije su žrtve zaposleni u javnobeležničkim kancelarijama ""koji obavljaju odgovoran posao overavanja potpisa birača za predstojeće izbore u Srbiji""."
31,"Muškarac kod Kragujevca vozio sa 3,39 promila alkohola u krvi",http://rs.n1info.com/Vesti/a575586/Muskarac-kod-Kragujevca-vozio-sa-3-39-promila-alkohola-u-krvi.html,"Muškarac (43) u mestu Goločelo upravljao je vozilom sa 3,39 promila alkohola u krvi, usled čega je izgubio kontrolu i sleteo sa puta."
32,Brojanje Tasovaca,http://rs.n1info.com/Vesti/a575576/Nova-kolumna-Draze-Petrovica-Brojanje-Tasovaca.html,"Česta je ta scena koja se pojavljuje u Koraksovim karikaturama da pred neke izbore predsednik Vučić, kobajagi, broji ovce koje poslušno idu ka biračkoj kutiji. Međutim, praveći listu za parlamentarne izbore, predsednik Vučić je odlučio da ovaj put ne broji samo ovce, već da broji i specijalnu vrstu intelektualca koje je uspeo da osvoji svojom harizmom, mudošću i pameću, takozvane Tasovce."
33,Ministarstvo izradilo aplikaciju o koncentracijama alergenog polena u vazduhu,http://rs.n1info.com/SciTech/a575584/Ministarstvo-izradilo-aplikaciju-o-koncentracijama-alergenog-polena-u-vazduhu.html,"Ministarstvo zaštite životne sredine izradilo je aplikaciju ""Alergeni polen"", koja prikazuje podatke o koncentracijama alergenog polena u vazduhu na 26 mernih mesta, saopšteno je."
34,"U Bugarskoj škole zatvorene zbog gripa, nema koronavirusa",http://rs.n1info.com/Region/a575580/U-Bugarskoj-skole-zatvorene-zbog-gripa-nema-koronavirusa.html,"Bugarska je zatvorila škole na nekoliko dana, ali ne zbog koronavirusa, već zbog posebno virulentne epidemije gripa koja zahteva izuzetne zdravstvene mere."
35,Vucic estimates: Not many will be infected in Serbia; man can't be tested,http://rs.n1info.com/English/NEWS/a575582/Vucic-estimates-Not-many-will-be-infected-in-Serbia-man-can-t-be-tested.html,"Serbia's President Aleksandar Vucic said on Friday there was no reason for panic following the first case of a man tested positive on coronavirus, adding Serbia was not the epidemic hotspot, and if more people were infected, the numbers might go up to a dozen, not hundreds and thousands as in China, Italy and South Korea, the Beta news agency reported."
36,"Prvih 100 dana EK: Oživeo proces proširenja, Zapadni Balkan prioritet",http://rs.n1info.com/Svet/a575578/Prvih-100-dana-EK-Oziveo-proces-prosirenja-Zapadni-Balkan-prioritet.html,"Evropska komisija je pod vođstvom predsednice Ursule fon der Lajen nastojala da oživi proces proširenja Evropske unije, a angažovanje u zemljama Zapadnog Balkana ostaće prioritet do kraja mandata, saopštila je EK povodom prvih 100 dana rada."
37,Šesnaestogodišnjak u karantinu leskovačke bolnice zbog sumnje na koronavirus,http://rs.n1info.com/Vesti/a575574/Sesnaestogodisnjak-u-karantinu-leskovacke-bolnice-zbog-sumnje-na-koronavirus.html,"Dečak (16) iz Vlasotinca smešten je u karantin na Infektivnom odeljenju Opšte bolnice u Leskovcu zbog sumnje da je oboleo od koronavirusa, potvrdio je agenciji Beta direktor te bolnice Nebojša Dimitrijević."
38,Predsednik Skupštine Crne Gore sa ambasadorom Srbije: Dijalog je jedino rešenje,http://rs.n1info.com/Region/a575572/Predsednik-Skupstine-Crne-Gore-sa-ambasadorom-Srbije-Dijalog-je-jedino-resenje.html,"Sa državama regiona Crna Gora gradi odnose utemeljene na interesima svojih građana, ekonomskoj i geografskoj upućenosti, izjavio je predsednik Skupštine Ivan Brajović tokom prijema novoimenovanog ambasadora Srbije Vladimira Božovića."
39,Oglašena druga prodaja nepokretne imovine preduzeća Park invest Jug,http://rs.n1info.com/Biznis/a575570/Tender-dana.html,"Stečajni upravnik oglasio je drugu prodaju nepokretne imovine preduzeća Park invest Jug, metodom javnog nadmetanja."
40,Joksimović: Žene nikada ne treba da se odreknu dostignutog prava,http://rs.n1info.com/Vesti/a575568/Joksimovic-Zene-nikada-ne-treba-da-se-odreknu-dostignutog-prava.html,"Ministarka za evrointegracije Jadranka Joksimović kazala je da žene nikada ne treba da se odreknu dostignutog prava, koje je, kako je navela, dodatno unapređeno inicijativom koja je prihvaćena od 40 odsto žena na listama."
41,"""IS nevesta"", koja je žrtvovala i svoju decu, pred sudom u Nemačkoj",http://rs.n1info.com/Svet/a575562/IS-nevesta-koja-je-zrtvovala-i-svoju-decu-pred-sudom-u-Nemackoj.html,Jedna majka iz Oberhauzena s troje dece odlazi u Siriju i priključuje se Islamskoj državi. Šestogodišnjeg sina daje na obuku za dete-vojnika. Poginuo je. Njoj danas počinje suđenje u Diseldorfu.
42,"Psi otkrivaju toplinu ""infracrvenim senzorom"" u nosu",http://rs.n1info.com/Ljubimci/a575564/Psi-otkrivaju-toplinu-infracrvenim-senzorom-u-nosu.html,"Psi imaju neku vrstu infracrvenog senzora u nosu kojim mogu da u minutu otkriju promene u temperaturi nastale, na primer, u blizini druge životinje, stoji u studiji mađarskih i švedskih naučnika."
43,"Akademska akcija od REM traži zabranu emitovanja Pinka, Hepija i Studija B",http://rs.n1info.com/Vesti/a575560/Akademska-akcija-od-REM-trazi-zabranu-emitovanja-Pinka-Hepija-i-Studija-B.html,"Članovi akademske zajednice Akademska akcija uputili su Regulatornoj agenciji za elektronske medije (REM) zahtev za razrešenje članova Upravnog odbora Radio-televizije Srbije i zatražila zabranu emitovanja informativnog i političkog programa televizija Pink, Hepi i Studio B."
44,Kinezi dizajnirali robotizovanu ruku za pregled osoba sa koronavirusom,http://rs.n1info.com/Zdravlje/a575284/Naucnici-dizajnirali-robote-za-pregled-zarazenih-koronavirusom.html,Naučnici jednog od najboljih Univerziteta u Kinu dizajnirali su robotsku ruku za koju tvrde da bi mogla da spašava živote u jeku epidemije koronavirusa.
45,Brnabić: Platni razredi najbolji za pravičan obračun i isplatu plata,http://rs.n1info.com/Vesti/a575558/Brnabic-Platni-razredi-najbolji-za-pravican-obracun-i-isplatu-plata.html,"Predsednica Vlade Srbije Ana Brnabić rekla je da je neophodno naći sistemsko rešenje za pravičan i ravnomeran obračun i isplatu plata prema složenosti posla, saopštio je njen kabinet."
46,Serbia’s GDP rose more than four percent in 2019,http://rs.n1info.com/English/NEWS/a575556/Serbia-s-GDP-rose-more-than-four-percent-in-2019.html,"Serbia’s GDP stood at 45.9 billion Euro in 2019, showing a rise of 4.2 percent, the Finance Ministry said on Friday."
47,"""1 od 5 miliona"" predstavio aplikaciju za prijavu izbornih nepravilnosti",http://rs.n1info.com/Izbori-2020/a575554/1-od-5-miliona-predstavio-aplikaciju-za-prijavu-izbornih-nepravilnosti.html,"Pokret #1od5miliona imaće pet miliona kontrolora na predstojećim izborima, zahvaljujući novoj aplikaciji za prijavu izbornih nepravilnosti, koja je danas predstavljena, najavila je predstavnica Pokreta Valentina Reković."
48,"EU Delegation denies financing Vucic documentary, authors to file suit",http://rs.n1info.com/English/NEWS/a575552/EU-Delegation-denies-financing-Vucic-documentary-authors-to-file-suit.html,The Delegation of the European Union on Friday confirmed that the Ruler (Vladalac) two-part documentary about President Aleksandar Vucic’s political biography was not financed by the EU.
49,"Prijatelj obolelog iz Subotice hoće da se pregleda, naišao na ""gluve telefone""",http://rs.n1info.com/Vesti/a575548/Prijatelj-obolelog-iz-Subotice-hoce-da-se-pregleda-naisao-na-gluve-telefone.html,"Prvi slučaj koronavirusa u Srbiji registrovan je 43-godišnjeg Subotičanina koji je boravio u više navrata u Budimpešti. On je smešten u izolaciju u bolnici u Subotici gde su za N1 rekli da su od Ministarstva zdravlja da o tome govore, te da nemaju ništa novo da kažu u odnosu na ono što je resorni ministar Zlatibor Lončar saopštio jutros na konferenciji za novinare."
50,OSCE mission chief warns of drop in professional standards on Serbian TV,http://rs.n1info.com/English/NEWS/a575546/OSCE-mission-chief-warns-of-drop-in-professional-standards-on-Serbian-TV.html,OSCE Serbia mission chief Andrea Oriziowarned on Friday of a drop in professional standards and a lack of pluralism on TV stations with national coverage.
51,Novi dan: Zloupotrebe ličnih podataka za račun političkih stranaka,http://rs.n1info.com/Vesti/a575544/Novi-dan-najava.html,"Stranački aktivisti krenuli su u kampanju ""od vrata do vrata"" i pre nego što su raspisani izbori. Veliki broj građana obratio se Povereniku za zaštitu informacija od javnog značaja i podataka o ličnosti, upravo sa tvrdnjama da stranački aktivisti raspolažu njihovim ličnim podacima. Iako je kampanja ""od vrata do vrata"" uobičajena praksa u SAD, Velikoj Britaniji, Australiji i Kanadi, u Srbiji izaziva uznemirenost kod građana, s obzirom da zloupotrebe ličnih podataka u svrhu stranačkog delovanja poslednjih godina nisu retkost u našoj zemlji."
52,"Vučić: Ukoliko bude opasnosti od migranata, zatvaranje granica u roku od 12 sati",http://rs.n1info.com/Vesti/a575542/Vucic-Ukoliko-bude-opasnosti-od-migranata-granice-ce-biti-zatvorene-u-roku-od-12-sati.html,"Predsednik Aleksandar Vučić izjavio je da će granice Srbije biti zatvorene u roku od 12 sati, ukoliko bude opasnosti od migrantske krize."
